{"fixtureVersion":1,"protocolVersion":"2025-06-18","direction":"server-to-client","transport":"stdio","message":{"jsonrpc":"2.0","id":9,"method":"sampling/createMessage","params":{"messages":[{"role":"user","content":{"type":"text","text":"fixture"}}],"maxTokens":8}},"expected":{"forward":true,"decision":"not-applicable"}}
