{"fixtureVersion":1,"protocolVersion":"2025-06-18","direction":"client-to-server","transport":"stdio","message":{"jsonrpc":"2.0","id":1,"method":"initialize","params":{"protocolVersion":"2025-06-18","capabilities":{},"clientInfo":{"name":"fixture-client","version":"0.0.0"}}},"expected":{"forward":true,"decision":"allow"}}
