{"fixtureVersion":1,"protocolVersion":"2025-06-18","direction":"server-to-client","transport":"stdio","message":{"jsonrpc":"2.0","id":12,"result":{"content":[{"type":"text","text":"ok"},{"type":"image","data":"AA==","mimeType":"image/png"},{"type":"audio","data":"AA==","mimeType":"audio/wav"},{"type":"resource","resource":{"uri":"file:///fixture.txt","text":"fixture"}},{"type":"resource_link","uri":"https://example.invalid/fixture"}],"structuredContent":{"ok":true}}},"expected":{"forward":true,"decision":"not-applicable"}}
